{
  "schema_version": "1.0",
  "diagram_type": "legal_hierarchy",
  "template_id": "legal_hierarchy_v1",
  "title": "虚构数据治理规范效力层级",
  "summary": "仅用于演示上位规则、实施规则与内部指引之间的层级关系，不代表任何真实法律体系。",
  "nodes": [
    {"id":"law_framework","type":"law","label":"示例数据治理法","details":"虚构的上位规则。","status":"effective","importance":"critical","source_refs":["src_fixture"],"tags":["虚构","上位规则"],"metadata":{"full_name":"示例数据治理法（虚构）","authority_level":"law","validity_status":"fictional_effective","version":"fictional-1.0"}},
    {"id":"reg_implementation","type":"regulation","label":"示例数据治理条例","details":"虚构的实施性规则。","status":"effective","importance":"high","source_refs":["src_fixture"],"tags":["虚构","实施规则"],"metadata":{"full_name":"示例数据治理条例（虚构）","authority_level":"regulation","validity_status":"fictional_effective","version":"fictional-1.0"}},
    {"id":"rule_department","type":"department_rule","label":"示例数据报送办法","details":"虚构的部门层面操作规则。","status":"effective","importance":"normal","source_refs":["src_fixture"],"tags":["虚构","操作规则"],"metadata":{"full_name":"示例数据报送办法（虚构）","authority_level":"department_rule","validity_status":"fictional_effective","version":"fictional-1.0"}},
    {"id":"doc_internal","type":"normative_document","label":"示例报送操作指引","details":"虚构的非立法性操作指引。","status":"effective","importance":"low","source_refs":["src_fixture"],"tags":["虚构","指引"],"metadata":{"full_name":"示例报送操作指引（虚构）","authority_level":"normative_document","validity_status":"fictional_effective","version":"fictional-1.0"}}
  ],
  "edges": [
    {"id":"edge_law_reg","source":"law_framework","target":"reg_implementation","relation":"superior_to","label":"效力高于","strength":"conclusive","source_refs":["src_fixture"],"metadata":{}},
    {"id":"edge_reg_rule","source":"reg_implementation","target":"rule_department","relation":"superior_to","label":"效力高于","strength":"conclusive","source_refs":["src_fixture"],"metadata":{}},
    {"id":"edge_rule_doc","source":"rule_department","target":"doc_internal","relation":"superior_to","label":"效力高于","strength":"strong","source_refs":["src_fixture"],"metadata":{}},
    {"id":"edge_reg_auth","source":"reg_implementation","target":"law_framework","relation":"authorized_by","label":"依据上位规则制定","strength":"strong","source_refs":["src_fixture"],"metadata":{}}
  ],
  "groups": [{"id":"group_norms","label":"虚构规范体系","node_ids":["law_framework","reg_implementation","rule_department","doc_internal"],"parent_group_id":null,"collapsed_by_default":false,"source_refs":["src_fixture"]}],
  "sources": [{"id":"src_fixture","kind":"human_input","title":"虚构层级样例设定","locator":"仓库内测试样例，无现实对应主体","verification_status":"human_confirmed"}],
  "layout_hints": {"direction":"top_down","preferred_root_ids":["law_framework"],"group_by":"node_type","max_initial_nodes":50,"timeline_lane":"single"},
  "display_options": {"theme":"light","show_legend":true,"show_sources":true,"hide_weak_edges":false,"collapse_low_importance":false,"print_page_size":"a4_portrait"},
  "provenance": {"generated_by":"human","generated_at":"2026-07-21T10:00:00+08:00","diagram_spec_version":"1.0","template_version":"1.0.0","source_file_ids":["src_fixture"],"human_confirmed":false,"parent_spec_hash":null,"change_summary":"第一阶段纯虚构样例","model_content_scope":"未使用模型生成真实事实；内容为虚构测试数据。","deterministic_content_scope":"结构校验、布局和 HTML 渲染由固定模板确定。"}
}
