{
  "schema_version":"1.0","diagram_type":"case_party_relationship","template_id":"case_party_relationship_v1",
  "title":"虚构股权与控制关系","summary":"演示直接持股、间接控制和关联主体；公司与自然人名称均为虚构。",
  "nodes":[
    {"id":"party_investor_a","type":"party","label":"甲辰投资有限公司","details":"虚构投资主体。","status":"active","importance":"critical","source_refs":["src_registry"],"tags":["虚构","股东"],"metadata":{"role":"投资方","organization_type":"company","ownership_percent":"60.00"}},
    {"id":"party_holding_b","type":"party","label":"乙巳控股有限公司","details":"虚构中间持股主体。","status":"active","importance":"high","source_refs":["src_registry"],"tags":["虚构","控股公司"],"metadata":{"role":"中间持股主体","organization_type":"company","ownership_percent":"80.00"}},
    {"id":"party_operating_c","type":"party","label":"丙午科技有限公司","details":"虚构经营主体。","status":"active","importance":"high","source_refs":["src_registry"],"tags":["虚构","目标公司"],"metadata":{"role":"目标公司","organization_type":"company"}},
    {"id":"party_manager_d","type":"party","label":"自然人丁某甲","details":"虚构管理人员，不对应真实个人。","status":"active","importance":"normal","source_refs":["src_minutes"],"tags":["虚构","管理人员"],"metadata":{"role":"经理","organization_type":"individual"}}
  ],
  "edges":[
    {"id":"edge_a_owns_b","source":"party_investor_a","target":"party_holding_b","relation":"owns","label":"直接持股60%","strength":"strong","source_refs":["src_registry"],"metadata":{"ownership_percent":"60.00"}},
    {"id":"edge_b_owns_c","source":"party_holding_b","target":"party_operating_c","relation":"owns","label":"直接持股80%","strength":"strong","source_refs":["src_registry"],"metadata":{"ownership_percent":"80.00"}},
    {"id":"edge_a_controls_c","source":"party_investor_a","target":"party_operating_c","relation":"controls","label":"通过中间主体控制","strength":"moderate","source_refs":["src_registry","src_minutes"],"metadata":{"control_basis":"fictional_shareholding_chain"}},
    {"id":"edge_d_represents_c","source":"party_manager_d","target":"party_operating_c","relation":"represents","label":"依虚构授权处理经营事项","strength":"moderate","source_refs":["src_minutes"],"metadata":{}}
  ],
  "groups":[{"id":"group_equity","label":"股权链","node_ids":["party_investor_a","party_holding_b","party_operating_c"],"parent_group_id":null,"collapsed_by_default":false,"source_refs":["src_registry"]}],
  "sources":[
    {"id":"src_registry","kind":"table","title":"虚构股权登记表","locator":"测试附件 A，表 1","artifact_id":"fixture_equity_a","table":"表1","verification_status":"original_material"},
    {"id":"src_minutes","kind":"paragraph","title":"虚构管理会议纪要","locator":"测试附件 B，第 3 段","artifact_id":"fixture_minutes_b","paragraph":"第3段","verification_status":"original_material"}
  ],
  "layout_hints":{"direction":"left_right","preferred_root_ids":["party_investor_a"],"group_by":"party","max_initial_nodes":50,"timeline_lane":"single"},
  "display_options":{"theme":"light","show_legend":true,"show_sources":true,"hide_weak_edges":false,"collapse_low_importance":false,"print_page_size":"a4_landscape"},
  "provenance":{"generated_by":"human","generated_at":"2026-07-21T10:15:00+08:00","diagram_spec_version":"1.0","template_version":"1.0.0","source_file_ids":["src_registry","src_minutes"],"human_confirmed":false,"parent_spec_hash":null,"change_summary":"第一阶段纯虚构股权控制样例","model_content_scope":"只整理虚构主体与关系，控制结论保持测试语义。","deterministic_content_scope":"关系校验、布局和 HTML 渲染由固定模板完成。"}
}
