{
  "schema_version":"1.0","diagram_type":"case_issue_evidence_law","template_id":"case_issue_evidence_law_v1",
  "title":"虚构劳动争议争点图","summary":"演示劳动关系、加班与工资支付三个争点，全部人物、单位、记录和规则均为虚构。",
  "nodes":[
    {"id":"party_worker","type":"party","label":"劳动者己某丙","details":"虚构劳动者，不对应真实个人。","status":"active","importance":"high","source_refs":["src_scenario"],"tags":["虚构","劳动者"],"metadata":{"role":"劳动者","organization_type":"individual"}},
    {"id":"party_employer","type":"party","label":"晨风信息有限公司","details":"虚构用人单位。","status":"active","importance":"high","source_refs":["src_scenario"],"tags":["虚构","用人单位"],"metadata":{"role":"用人单位","organization_type":"company"}},
    {"id":"issue_relation","type":"issue","label":"是否存在劳动关系","details":"双方对关系性质存在分歧。","status":"disputed","importance":"critical","source_refs":["src_payroll","src_access"],"tags":["劳动争议"],"metadata":{}},
    {"id":"issue_overtime","type":"issue","label":"是否存在加班事实","details":"考勤只记录门禁时间，不能单独确认工作内容。","status":"disputed","importance":"critical","source_refs":["src_access"],"tags":["劳动争议","加班"],"metadata":{}},
    {"id":"evidence_payroll","type":"evidence","label":"连续工资转账记录","details":"虚构单位连续六个月按月转账。","status":"supported","importance":"high","source_refs":["src_payroll"],"tags":["工资"],"metadata":{"evidence_name":"虚构工资转账记录","evidence_type":"bank_statement","authenticity":"fixture_original","examined":false,"probative_value":"moderate"}},
    {"id":"evidence_access","type":"evidence","label":"门禁导出表","details":"仅显示进出时间，缺少排班和工作指令。","status":"supported","importance":"normal","source_refs":["src_access"],"tags":["考勤","局限"],"metadata":{"evidence_name":"虚构门禁导出表","evidence_type":"access_log","authenticity":"fixture_original","examined":false,"probative_value":"weak","defects":["不能单独证明工作内容"]}},
    {"id":"missing_schedule","type":"missing_information","label":"缺少排班与加班审批记录","details":"需要补充能够对应具体日期和工作任务的材料。","status":"unknown","importance":"high","source_refs":["src_scenario"],"tags":["待补证"],"metadata":{"requested_item":"schedule_and_overtime_approval"}},
    {"id":"rule_labor","type":"rule","label":"虚构劳动争议分析规则","details":"仅作测试：主体管理、持续报酬和实际工作等要素需要结合判断。","status":"effective","importance":"high","source_refs":["src_scenario"],"tags":["虚构规则"],"metadata":{"full_name":"示例劳动争议分析规则（虚构）","version":"2026-test-v1","validity_status":"fictional_only","official_source":"lawyer-assistance://fixtures/labor-rule"}}
  ],
  "edges":[
    {"id":"edge_employs","source":"issue_relation","target":"party_worker","relation":"involves","label":"争点涉及劳动者","strength":"moderate","source_refs":["src_payroll","src_access"],"metadata":{}},
    {"id":"edge_payroll_supports","source":"evidence_payroll","target":"issue_relation","relation":"supports","label":"支持持续报酬事实","strength":"moderate","source_refs":["src_payroll"],"metadata":{}},
    {"id":"edge_access_supports","source":"evidence_access","target":"issue_overtime","relation":"supports","label":"弱支持在场时间","strength":"weak","source_refs":["src_access"],"metadata":{}},
    {"id":"edge_rule_relation","source":"rule_labor","target":"issue_relation","relation":"applies_to","label":"适用于关系认定","strength":"strong","source_refs":["src_scenario"],"metadata":{}},
    {"id":"edge_rule_overtime","source":"rule_labor","target":"issue_overtime","relation":"applies_to","label":"适用于加班争点","strength":"strong","source_refs":["src_scenario"],"metadata":{}},
    {"id":"edge_rule_missing","source":"rule_labor","target":"evidence_access","relation":"requires","label":"需要证据核验","strength":"moderate","source_refs":["src_scenario"],"metadata":{}}
  ],
  "groups":[{"id":"group_labor_issues","label":"劳动争议焦点","node_ids":["issue_relation","issue_overtime","evidence_payroll","evidence_access","missing_schedule"],"parent_group_id":null,"collapsed_by_default":false,"source_refs":["src_scenario"]}],
  "sources":[
    {"id":"src_scenario","kind":"human_input","title":"虚构劳动争议设定","locator":"仓库内测试样例，无现实对应案件","verification_status":"human_confirmed"},
    {"id":"src_payroll","kind":"table","title":"虚构工资转账表","locator":"测试附件 P1，表 1","artifact_id":"fixture_payroll","table":"表1","verification_status":"original_material"},
    {"id":"src_access","kind":"table","title":"虚构门禁记录","locator":"测试附件 A1，表 1","artifact_id":"fixture_access","table":"表1","verification_status":"original_material"}
  ],
  "layout_hints":{"direction":"left_right","preferred_root_ids":["issue_relation","issue_overtime"],"group_by":"issue","max_initial_nodes":50,"timeline_lane":"single"},
  "display_options":{"theme":"light","show_legend":true,"show_sources":true,"hide_weak_edges":false,"collapse_low_importance":false,"print_page_size":"a4_landscape"},
  "provenance":{"generated_by":"human","generated_at":"2026-07-21T10:30:00+08:00","diagram_spec_version":"1.0","template_version":"1.0.0","source_file_ids":["src_scenario","src_payroll","src_access"],"human_confirmed":false,"parent_spec_hash":null,"change_summary":"第一阶段纯虚构劳动争议样例","model_content_scope":"仅梳理虚构争点与证据局限，不输出案件结论。","deterministic_content_scope":"模板、验证、布局和 HTML 渲染由固定代码执行。"}
}
