{
  "schema_version":"1.0","diagram_type":"case_timeline","template_id":"case_timeline_v1","title":"虚构时间矛盾（注册样例）","summary":"演示同一交付事件的两个日期陈述和后续付款，全部内容均为虚构。",
  "nodes":[
    {"id":"ct_contract","type":"event","label":"签订虚构合同","details":"测试合同记载 2 月 1 日签订。","status":"established","importance":"high","source_refs":["ct_contract_src"],"tags":["虚构"],"metadata":{"date":"2026-02-01","date_precision":"day","sequence":1}},
    {"id":"ct_delivery_a","type":"event","label":"陈述甲：2 月 10 日交付","details":"虚构送货单日期。","status":"alleged","importance":"critical","source_refs":["ct_delivery_src"],"tags":["时间矛盾"],"metadata":{"date":"2026-02-10","date_precision":"day","sequence":2,"statement_variant":"seller_document"}},
    {"id":"ct_delivery_b","type":"event","label":"陈述乙：2 月 14 日收货","details":"虚构邮件日期。","status":"disputed","importance":"critical","source_refs":["ct_email_src"],"tags":["时间矛盾"],"metadata":{"date":"2026-02-14","date_precision":"day","sequence":2,"statement_variant":"buyer_email"}},
    {"id":"ct_payment","type":"event","label":"支付部分价款","details":"虚构流水显示 2 月 18 日付款。","status":"supported","importance":"high","source_refs":["ct_bank_src"],"tags":["付款"],"metadata":{"date":"2026-02-18","date_precision":"day","sequence":3}},
    {"id":"ct_missing","type":"missing_information","label":"缺少承运系统原始时间","details":"需要核对两个交付日期。","status":"unknown","importance":"high","source_refs":["ct_delivery_src","ct_email_src"],"tags":["待补证"],"metadata":{"requested_item":"carrier_original_timestamp"}}
  ],
  "edges":[
    {"id":"ct_edge_before_a","source":"ct_contract","target":"ct_delivery_a","relation":"occurred_before","label":"先于","strength":"strong","source_refs":["ct_contract_src","ct_delivery_src"],"metadata":{}},
    {"id":"ct_edge_before_b","source":"ct_contract","target":"ct_delivery_b","relation":"occurred_before","label":"先于","strength":"strong","source_refs":["ct_contract_src","ct_email_src"],"metadata":{}},
    {"id":"ct_edge_conflict","source":"ct_delivery_a","target":"ct_delivery_b","relation":"conflicts_in_time_with","label":"日期冲突","strength":"strong","source_refs":["ct_delivery_src","ct_email_src"],"metadata":{}},
    {"id":"ct_edge_pay_a","source":"ct_delivery_a","target":"ct_payment","relation":"occurred_before","label":"按陈述甲先于付款","strength":"moderate","source_refs":["ct_delivery_src","ct_bank_src"],"metadata":{}},
    {"id":"ct_edge_pay_b","source":"ct_delivery_b","target":"ct_payment","relation":"occurred_before","label":"按陈述乙先于付款","strength":"moderate","source_refs":["ct_email_src","ct_bank_src"],"metadata":{}}
  ],
  "groups":[{"id":"ct_group","label":"交付时间的两个版本","node_ids":["ct_delivery_a","ct_delivery_b","ct_missing"],"parent_group_id":null,"collapsed_by_default":false,"source_refs":["ct_delivery_src","ct_email_src"]}],
  "sources":[
    {"id":"ct_contract_src","kind":"file_page","title":"虚构买卖合同","locator":"测试合同第 1 页","artifact_id":"fixture_timeline_contract","page":1,"verification_status":"original_material"},
    {"id":"ct_delivery_src","kind":"attachment","title":"虚构送货单","locator":"测试附件 T1","artifact_id":"fixture_timeline_delivery","attachment":"T1","verification_status":"original_material"},
    {"id":"ct_email_src","kind":"paragraph","title":"虚构收货邮件","locator":"测试附件 T2，第 2 段","artifact_id":"fixture_timeline_email","paragraph":"第2段","verification_status":"original_material"},
    {"id":"ct_bank_src","kind":"table","title":"虚构付款流水","locator":"测试附件 T3，表 1","artifact_id":"fixture_timeline_bank","table":"表1","verification_status":"original_material"}
  ],
  "layout_hints":{"direction":"timeline","preferred_root_ids":["ct_contract"],"group_by":"status","max_initial_nodes":50,"timeline_lane":"by_statement"},
  "display_options":{"theme":"light","show_legend":true,"show_sources":true,"hide_weak_edges":false,"collapse_low_importance":false,"print_page_size":"a4_landscape"},
  "provenance":{"generated_by":"human","generated_at":"2026-07-21T11:30:00+08:00","diagram_spec_version":"1.0","template_version":"1.0.0","source_file_ids":["ct_contract_src","ct_delivery_src","ct_email_src","ct_bank_src"],"human_confirmed":false,"parent_spec_hash":null,"change_summary":"注册表虚构样例","model_content_scope":"只标注虚构顺序和冲突，不选择任一陈述。","deterministic_content_scope":"日期校验、布局和 HTML 渲染由固定模板完成。"}
}
